{"analytic":{"S":[0.313905191148,0.44241114479,0.0],"ST":[0.55758885521,0.44241114479,0.243683664062],"V":13.844587940719,"V1":4.345888023894,"V13":3.373699916825,"V2":6.125,"V3":0.0},"generated_at":"2026-10-11T00:00:00Z","oat":{"baselines":[{"base":[0.0,0.0,0.0],"f_base":0.0,"grid":[-3.1415926536,-2.8274333882,-2.5132741229,-2.1991148575,-1.8849555922,-1.5707963268,-1.2566370614,-0.9424777961,-0.6283185307,-0.3141592654,0.0,0.3141592654,0.6283185307,0.9424777961,1.2566370614,1.5707963268,1.8849555922,2.1991148575,2.5132741229,2.8274333882,3.1415926536],"sweeps":[{"input":"x1","range":2.0,"y":[0.0,-0.30901699,-0.58778525,-0.80901699,-0.95105652,-1.0,-0.95105652,-0.80901699,-0.58778525,-0.30901699,0.0,0.30901699,0.58778525,0.80901699,0.95105652,1.0,0.95105652,0.80901699,0.58778525,0.30901699,0.0]},{"input":"x2","range":7.0,"y":[0.0,0.66844052,2.41844052,4.58155948,6.33155948,7.0,6.33155948,4.58155948,2.41844052,0.66844052,0.0,0.66844052,2.41844052,4.58155948,6.33155948,7.0,6.33155948,4.58155948,2.41844052,0.66844052,0.0]},{"input":"x3","range":0.0,"y":[0.0,0.0,0.0,0.0,0.0,0.0,0.0,0.0,0.0,0.0,0.0,0.0,0.0,0.0,0.0,0.0,0.0,0.0,0.0,0.0,0.0]}]},{"base":[1.5707963267948966,0.5,2.0],"f_base":4.2089419295,"grid":[-3.1415926536,-2.8274333882,-2.5132741229,-2.1991148575,-1.8849555922,-1.5707963268,-1.2566370614,-0.9424777961,-0.6283185307,-0.3141592654,0.0,0.3141592654,0.6283185307,0.9424777961,1.2566370614,1.5707963268,1.8849555922,2.1991148575,2.5132741229,2.8274333882,3.1415926536],"sweeps":[{"input":"x1","range":5.2,"y":[1.60894193,0.80549774,0.08070027,-0.49450226,-0.86380501,-0.99105807,-0.86380501,-0.49450226,0.08070027,0.80549774,1.60894193,2.41238611,3.13718359,3.71238611,4.08168887,4.20894193,4.08168887,3.71238611,3.13718359,2.41238611,1.60894193]},{"input":"x2","range":7.0,"y":[2.6,3.26844052,5.01844052,7.18155948,8.93155948,9.6,8.93155948,7.18155948,5.01844052,3.26844052,2.6,3.26844052,5.01844052,7.18155948,8.93155948,9.6,8.93155948,7.18155948,5.01844052,3.26844052,2.6]},{"input":"x3","range":9.7409091,"y":[12.34985103,8.99995239,6.5988183,4.94773421,3.87136375,3.21774875,2.8583092,2.68784329,2.62452738,2.60991602,2.60894193,2.60991602,2.62452738,2.68784329,2.8583092,3.21774875,3.87136375,4.94773421,6.5988183,8.99995239,12.34985103]}]},{"base":[1.0,1.0,1.0],"f_base":5.8821320112,"grid":[-3.1415926536,-2.8274333882,-2.5132741229,-2.1991148575,-1.8849555922,-1.5707963268,-1.2566370614,-0.9424777961,-0.6283185307,-0.3141592654,0.0,0.3141592654,0.6283185307,0.9424777961,1.2566370614,1.5707963268,1.8849555922,2.1991148575,2.5132741229,2.8274333882,3.1415926536],"sweeps":[{"input":"x1","range":2.2,"y":[4.95651393,4.61659523,4.30995015,4.06659523,3.91035176,3.85651393,3.91035176,4.06659523,4.30995015,4.61659523,4.95651393,5.29643262,5.60307771,5.84643262,6.0026761,6.05651393,6.0026761,5.84643262,5.60307771,5.29643262,4.95651393]},{"input":"x2","range":7.0,"y":[0.92561808,1.5940586,3.3440586,5.50717756,7.25717756,7.92561808,7.25717756,5.50717756,3.3440586,1.5940586,0.92561808,1.5940586,3.3440586,5.50717756,7.25717756,7.92561808,7.25717756,5.50717756,3.3440586,1.5940586,0.92561808]},{"input":"x3","range":8.19669238,"y":[13.99467729,11.17583478,9.15535011,7.76601075,6.86027624,6.31027819,6.00782024,5.86437812,5.81109962,5.79880458,5.79798491,5.79880458,5.81109962,5.86437812,6.00782024,6.31027819,6.86027624,7.76601075,9.15535011,11.17583478,13.99467729]}]}],"reading":"OAT at the origin sees no x3 effect (sin x1 = 0 there); Sobol total index ST3 = 0.2437 reveals it"},"quadrature_check":{"abs_err_V":7.105427357601002e-15,"max_abs_err_S":5.551115123125783e-17,"max_abs_err_ST":2.220446049250313e-16,"points_per_axis":64},"schema_version":"v1","sobol":[{"N":256,"ST_mean":[0.507641,0.43588,0.257073],"ST_sd":[0.061378,0.037695,0.042051],"S_mean":[0.269509,0.450747,-0.013189],"S_sd":[0.102265,0.066956,0.097629],"evaluations":1280,"first":{"S":[0.1667763141,0.4630233824,-1.84567e-05],"ST":[0.4547268394,0.408046258,0.3363696321],"V":14.1152282797},"max_abs_err_S":0.241772,"mean_abs_err_ST":0.043958,"replicates":10},{"N":1024,"ST_mean":[0.535001,0.444888,0.248033],"ST_sd":[0.040978,0.013214,0.016632],"S_mean":[0.294377,0.468319,-0.001791],"S_sd":[0.059166,0.032254,0.019302],"evaluations":5120,"first":{"S":[0.2341369361,0.5140993314,-0.0311478246],"ST":[0.5195875151,0.4497707684,0.2732610218],"V":14.1960889593},"max_abs_err_S":0.120436,"mean_abs_err_ST":0.022098,"replicates":10},{"N":4096,"ST_mean":[0.548243,0.43895,0.245883],"ST_sd":[0.025646,0.009026,0.006196],"S_mean":[0.307118,0.444234,0.000868],"S_sd":[0.027511,0.018892,0.010701],"evaluations":20480,"first":{"S":[0.2809781773,0.4469412543,-0.0031318195],"ST":[0.5604049815,0.4410450076,0.2553725859],"V":13.6749340645},"max_abs_err_S":0.055594,"mean_abs_err_ST":0.011694,"replicates":10},{"N":16384,"ST_mean":[0.562177,0.44165,0.242695],"ST_sd":[0.008616,0.004519,0.003286],"S_mean":[0.317277,0.440441,-0.001171],"S_sd":[0.010442,0.009077,0.006113],"evaluations":81920,"first":{"S":[0.303223866,0.4409814752,-0.0010963923],"ST":[0.5530993868,0.4385608779,0.2405171402],"V":13.9133904181},"max_abs_err_S":0.019126,"mean_abs_err_ST":0.004901,"replicates":10}],"spec":{"citations":["Ishigami and Homma 1990","Saltelli et al. 2008","Surjanovic and Bingham, Virtual Library of Simulation Experiments"],"estimators":"Saltelli 2010 first order, Jansen total; see analytics/sens.py","function":"Ishigami f = sin x1 + A sin^2 x2 + B x3^4 sin x1, A=7, B=0.1, x ~ U[-pi,pi]^3 (Crestaux 2007 / Marrel 2009 convention)","note":"Indices are recomputed in tests from first principles (quadrature), not copied from papers.","salib_crosscheck":{"S1":[0.3142,0.4434,-0.0003],"ST":[0.5576,0.4422,0.2445]}},"tags":{"analytic":"DERIVED","oat":"DERIVED","quadrature_check":"DERIVED","sobol":"SIMULATED","vectors":"DERIVED"},"tolerance":{"abs":1e-09,"note":"function values and seeded Sobol estimates (same PRNG, same order of operations; allow 1e-9 relative for summation order)","rel":1e-09},"vectors":[{"f":[0.0,13.445138634775,-0.578882631039,0.0,4.956513927915,7.946913752539,5.384169533708,1.126519981241],"kind":"function","points":[[0,0,0],[1,2,3],[-1,0.5,2],[3.141592653589793,3.141592653589793,3.141592653589793],[-3.141592653589793,1,-2],[0.3,-1.2,2.7],[2.2,2.2,0.1],[-0.5,-0.5,-0.5]]},{"N":1024,"S":[0.3276656912,0.4430566547,-0.0008529215],"ST":[0.4853182471,0.4290074126,0.2221182546],"V":13.7536051218,"evaluations":5120,"kind":"saltelli","seed":2024},{"N":4096,"S":[0.2809781773,0.4469412543,-0.0031318195],"ST":[0.5604049815,0.4410450076,0.2553725859],"V":13.6749340645,"evaluations":20480,"kind":"saltelli","seed":20261011}]}